peer_group,security_code,security_name,prior_preliminary_attention,reviewer_decision,watch_selection_route,decision_source,reviewer_or_inferred_reason,capability_assessment,analyst_response,calibrated_standard_implication,applies_to_future_markets,source_urls,decided_at_utc
农林牧渔-畜牧业-动物用药,920729,永顺生物,borderline,watch,boundary_judged_watch,analyst_company_by_company_review,boundary watch for veterinary biologics niche despite small scale,永顺生物 is retained as a boundary veterinary biologics case because vaccine production qualification and product specialization are more defensible than ordinary animal drug distribution. Small scale keeps it boundary.,Watch. 永顺生物: 永顺生物 is retained as a boundary veterinary biologics case because vaccine production qualification and product specialization are more defensible than ordinary animal drug distribution. Small scale keeps it boundary. triage 60.92; moat 55.00; technology 72.25; market 41.75; quality 66.25; governance 70.25.,Veterinary-medicine groups should retain regulatory/R&D-heavy vaccine and animal-health platforms; generic veterinary drug capacity is rejected.,true,https://www.bse.cn/disclosure/announcement.html,2026-06-10T00:00:00+00:00
农林牧渔-畜牧业-动物用药,688526,科前生物,reject,watch,direct_watch,analyst_company_by_company_review,direct watch for animal vaccine R&D and university-linked platform,"科前生物 is retained as a direct animal-vaccine platform because R&D, strain/product pipeline, production quality, and customer validation are harder to replicate than generic veterinary drugs.","Watch. 科前生物: 科前生物 is retained as a direct animal-vaccine platform because R&D, strain/product pipeline, production quality, and customer validation are harder to replicate than generic veterinary drugs. triage 55.09; moat 41.50; technology 62.00; market 54.50; quality 62.00; governance 71.00.",Veterinary-medicine groups should retain regulatory/R&D-heavy vaccine and animal-health platforms; generic veterinary drug capacity is rejected.,true,https://www.sse.com.cn/assortment/stock/list/info/announcement/index.shtml?productId=688526,2026-06-10T00:00:00+00:00
农林牧渔-畜牧业-动物用药,300871,回盛生物,reject,reject_for_now,,analyst_company_by_company_review,rejected because veterinary exposure is generic or weaker than retained vaccine platforms,"回盛生物: The company has veterinary drug, animal-health, feed additive, antibiotic, vaccine, or related exposure, but the evidence does not show regulatory/R&D/product-platform strength enough versus retained animal-health companies.","Reject for now. 回盛生物: 回盛生物: The company has veterinary drug, animal-health, feed additive, antibiotic, vaccine, or related exposure, but the evidence does not show regulatory/R&D/product-platform strength enough versus retained animal-health companies. triage 54.59; moat 48.25; technology 54.50; market 62.00; quality 53.75; governance 68.00.",Veterinary-medicine groups should retain regulatory/R&D-heavy vaccine and animal-health platforms; generic veterinary drug capacity is rejected.,true,https://www.szse.cn/disclosure/listed/notice/index.html?stock=300871,2026-06-10T00:00:00+00:00
农林牧渔-畜牧业-动物用药,603566,普莱柯,reject,watch,boundary_judged_watch,analyst_company_by_company_review,boundary watch for veterinary vaccine and animal-health R&D platform,普莱柯 is retained as a boundary animal-health platform with vaccine and veterinary-drug R&D capability. It is not as clean as the strongest vaccine leader but remains differentiated versus generic animal drugs.,Watch. 普莱柯: 普莱柯 is retained as a boundary animal-health platform with vaccine and veterinary-drug R&D capability. It is not as clean as the strongest vaccine leader but remains differentiated versus generic animal drugs. triage 54.30; moat 42.75; technology 62.50; market 53.50; quality 59.75; governance 69.50.,Veterinary-medicine groups should retain regulatory/R&D-heavy vaccine and animal-health platforms; generic veterinary drug capacity is rejected.,true,https://www.sse.com.cn/assortment/stock/list/info/announcement/index.shtml?productId=603566,2026-06-10T00:00:00+00:00
农林牧渔-畜牧业-动物用药,600195,中牧股份,reject,watch,boundary_judged_watch,analyst_company_by_company_review,boundary watch for central-SOE veterinary biologics and animal-health platform,"中牧股份 is retained as a boundary veterinary biologics platform because regulatory approvals, production qualification, and state animal-health role create barriers. Execution and product cycle require deeper review.","Watch. 中牧股份: 中牧股份 is retained as a boundary veterinary biologics platform because regulatory approvals, production qualification, and state animal-health role create barriers. Execution and product cycle require deeper review. triage 54.01; moat 52.00; technology 51.00; market 69.50; quality 43.25; governance 67.25.",Veterinary-medicine groups should retain regulatory/R&D-heavy vaccine and animal-health platforms; generic veterinary drug capacity is rejected.,true,https://www.sse.com.cn/assortment/stock/list/info/announcement/index.shtml?productId=600195,2026-06-10T00:00:00+00:00
农林牧渔-畜牧业-动物用药,600201,生物股份,reject,watch,boundary_judged_watch,analyst_company_by_company_review,boundary watch for animal vaccine platform with established product history,"生物股份 is retained as a boundary animal vaccine and biologics platform. The moat is regulatory/R&D/product history rather than current profitability, but competition and product-cycle volatility keep it boundary.","Watch. 生物股份: 生物股份 is retained as a boundary animal vaccine and biologics platform. The moat is regulatory/R&D/product history rather than current profitability, but competition and product-cycle volatility keep it boundary. triage 52.62; moat 44.00; technology 59.75; market 54.00; quality 54.50; governance 68.75.",Veterinary-medicine groups should retain regulatory/R&D-heavy vaccine and animal-health platforms; generic veterinary drug capacity is rejected.,true,https://www.sse.com.cn/assortment/stock/list/info/announcement/index.shtml?productId=600201,2026-06-10T00:00:00+00:00
农林牧渔-畜牧业-动物用药,002688,金河生物,reject,reject_for_now,,analyst_company_by_company_review,rejected because veterinary exposure is generic or weaker than retained vaccine platforms,"金河生物: The company has veterinary drug, animal-health, feed additive, antibiotic, vaccine, or related exposure, but the evidence does not show regulatory/R&D/product-platform strength enough versus retained animal-health companies.","Reject for now. 金河生物: 金河生物: The company has veterinary drug, animal-health, feed additive, antibiotic, vaccine, or related exposure, but the evidence does not show regulatory/R&D/product-platform strength enough versus retained animal-health companies. triage 52.27; moat 49.50; technology 54.25; market 58.00; quality 49.50; governance 65.75.",Veterinary-medicine groups should retain regulatory/R&D-heavy vaccine and animal-health platforms; generic veterinary drug capacity is rejected.,true,https://www.szse.cn/disclosure/listed/notice/index.html?stock=002688,2026-06-10T00:00:00+00:00
农林牧渔-畜牧业-动物用药,300119,瑞普生物,reject,reject_for_now,,analyst_company_by_company_review,rejected because veterinary exposure is generic or weaker than retained vaccine platforms,"瑞普生物: The company has veterinary drug, animal-health, feed additive, antibiotic, vaccine, or related exposure, but the evidence does not show regulatory/R&D/product-platform strength enough versus retained animal-health companies.","Reject for now. 瑞普生物: 瑞普生物: The company has veterinary drug, animal-health, feed additive, antibiotic, vaccine, or related exposure, but the evidence does not show regulatory/R&D/product-platform strength enough versus retained animal-health companies. triage 50.26; moat 48.75; technology 39.00; market 70.00; quality 51.00; governance 66.50.",Veterinary-medicine groups should retain regulatory/R&D-heavy vaccine and animal-health platforms; generic veterinary drug capacity is rejected.,true,https://www.szse.cn/disclosure/listed/notice/index.html?stock=300119,2026-06-10T00:00:00+00:00
农林牧渔-畜牧业-动物用药,002868,*ST绿康,reject,reject_for_now,,analyst_company_by_company_review,rejected because veterinary exposure is generic or weaker than retained vaccine platforms,"*ST绿康: The company has veterinary drug, animal-health, feed additive, antibiotic, vaccine, or related exposure, but the evidence does not show regulatory/R&D/product-platform strength enough versus retained animal-health companies.","Reject for now. *ST绿康: *ST绿康: The company has veterinary drug, animal-health, feed additive, antibiotic, vaccine, or related exposure, but the evidence does not show regulatory/R&D/product-platform strength enough versus retained animal-health companies. triage 39.78; moat 38.25; technology 38.75; market 38.50; quality 34.00; governance 65.00.",Veterinary-medicine groups should retain regulatory/R&D-heavy vaccine and animal-health platforms; generic veterinary drug capacity is rejected.,true,https://www.szse.cn/disclosure/listed/notice/index.html?stock=002868,2026-06-10T00:00:00+00:00
