review_batch_id,security_code,security_name,annual_report_title,current_report_title,research_report_org,research_report_title,review_status,primary_strategy_tag_final,watchlist_decision_final,quality_tier_final,moat_conclusion,peer_double_check_conclusion,bear_case_summary,base_case_summary,bull_case_summary
batch-055,300353,东土科技,2025年年度报告,2026年一季度报告,中航证券有限公司,高端业务布局释放成效，25Q4及全年毛利率创下五年新高,reviewed_authoritative_deep_review,D-产业链爆发/关键瓶颈型,tactical_candidate,L3-战术候选,东土科技聚焦工业互联网、工业通信和时间敏感网络，高端业务体现工业现场协议、可靠性和客户验证壁垒。,相比普通通信设备，东土更靠近工业控制网络底层，但规模和盈利稳定性仍需验证，L3。,工业客户导入慢，费用拖累盈利。,高端工业通信业务逐步释放。,TSN/工业互联网成为国产工业网络核心供应商。
batch-055,600603,广汇物流,广汇物流股份有限公司2025年年度报告,广汇物流股份有限公司2026年第一季度报告,,,reviewed_with_public_research_gap,G-股东回报型低估/稳健资产,not_watch,L5-不纳入观察,广汇物流涉及物流和地产相关资产，业务受区域资产、地产周期和资本结构影响，护城河不清晰。,相比顺丰、京东物流等网络型平台或稀缺港口铁路资产，广汇物流不具备长期观察价值，L5。,地产和负债压力拖累。,存量资产经营稳定。,资产处置改善报表。
batch-055,603848,好太太,广东好太太科技集团股份有限公司2025年年度报告,广东好太太科技集团股份有限公司2026年第一季度报告,国信证券股份有限公司,2025年报&2026年一季报点评：一季度营收同比+22%，线下调改成效显现,reviewed_authoritative_deep_review,C-GARP成长型,not_watch,L5-不纳入观察,好太太在晾晒和智能家居有品牌与渠道，但产品门槛低，地产链和消费周期影响明显。,低壁垒家居五金不符合GARP严定义，L5。,地产后周期疲弱。,线下调改带来阶段性修复。,智能家居新品放量。
batch-055,301091,深城交,2025年年度报告,2026年一季度报告,,,reviewed_with_public_research_gap,C-GARP成长型,zero_position_watch,L4-零仓位观察,深城交在城市交通规划和数字交通有深圳场景经验，但咨询和项目制业务可复制性较高。,相比高粘性基础软件或硬件瓶颈，深城交项目制属性更强，L4。,地方财政约束导致项目延期。,数字交通项目稳步推进。,低空交通和城市治理平台化。
batch-055,600390,五矿资本,五矿资本股份有限公司2025年年度报告,五矿资本股份有限公司2026年第一季度报告,,,reviewed_with_public_research_gap,G-股东回报型低估/稳健资产,not_watch,L5-不纳入观察,五矿资本是金融控股平台，信托、证券、租赁等金融业务复杂，资本市场周期和信用风险较强。,相比招商银行、宁波银行等更清晰金融护城河，五矿资本复杂度高，L5。,信用风险和投资波动。,金融子公司稳定经营。,周期修复带来估值回升。
batch-055,688309,恒誉环保,2025年年度报告,2026年第一季度报告,,,reviewed_with_public_research_gap,C-GARP成长型,zero_position_watch,L4-零仓位观察,恒誉环保从事有机废弃物裂解设备，技术有专业性，但环保装备项目制强、需求波动大。,相比关键半导体设备或强运营资产，恒誉环保商业确定性不足，L4。,项目延期和回款慢。,环保设备订单恢复。,裂解装备标准化并复制。
batch-055,301156,美农生物,2025年年度报告,2026年一季度报告,环球富盛理财,深耕饲料添加剂和酶解蛋白饲料原料业务，重点突破海外市场,reviewed_authoritative_deep_review,C-GARP成长型,not_watch,L5-不纳入观察,美农生物从事饲料添加剂和酶解蛋白，产品和客户可替代性较强，行业高利润容易吸引进入者。,普通农牧添加剂不符合严进观察标准，L5。,养殖周期和价格竞争。,海外市场突破带来增长。,高端添加剂放量。
batch-055,301263,泰恩康,2025年年度报告,2026年一季度报告,华金证券股份有限公司,业绩短期承压，CKBA潜在空间广阔,reviewed_authoritative_deep_review,C-GARP成长型,zero_position_watch,L4-零仓位观察,泰恩康有医药商业和部分药品/管线布局，CKBA等潜在空间存在，但现阶段核心壁垒和兑现证据不足。,相比微芯、泽璟等更清晰创新药平台，泰恩康仍偏商业和单品预期，L4。,管线失败，商业业务承压。,存量药品稳定，管线推进。,CKBA成功兑现大品种潜力。
batch-055,688311,盟升电子,2025年年度报告全文,2026年第一季度报告,民生证券股份有限公司,2025年半年报点评：1H25营收同比增长50%；在电子对抗领域不断突破,reviewed_authoritative_deep_review,D-产业链爆发/关键瓶颈型,tactical_candidate,L3-战术候选,盟升电子在卫星导航、通信和电子对抗领域有军工客户、型号验证和可靠性门槛。,相比普通通信设备，盟升电子军工型号和卫星链条更稀缺，L3。,军工订单延期，回款慢。,卫星导航和电子对抗业务稳步增长。,电子对抗和卫星互联网型号放量。
batch-055,600882,妙可蓝多,2025年年度报告,2026年第一季度报告,中邮证券有限责任公司,产品矩阵全面升级，B端+C端双轮驱动,reviewed_authoritative_deep_review,A-DCF/现金流复利型,not_watch,L5-不纳入观察,妙可蓝多奶酪品牌曾有先发优势，但乳制品被伊利、蒙牛等渠道和资金强势压制，品类壁垒不足。,与强乳企相比缺少不可替代优势，L5。,费用高、渠道竞争压制利润。,产品矩阵调整后恢复。,奶酪品类扩容。
batch-055,301101,明月镜片,2025年年度报告,2026年一季度报告,信达证券股份有限公司,明月镜片：高潜品类加速放量，AI眼镜配套逐步强化，盈利能力改善可期,reviewed_authoritative_deep_review,C-GARP成长型,zero_position_watch,L4-零仓位观察,明月镜片在国产镜片品牌和渠道上有积累，高潜品类和AI眼镜配套有增量，但行业仍面临蔡司、依视路等强品牌。,相比全球光学龙头和真正光学器件瓶颈，明月镜片仍为L4。,价格竞争或渠道费用上升。,高潜品类增长改善利润。,AI眼镜配套形成新增长。
batch-055,688662,富信科技,广东富信科技股份有限公司2025年年度报告,广东富信科技股份有限公司2026年第一季度报告,,,reviewed_with_public_research_gap,D-产业链爆发/关键瓶颈型,zero_position_watch,L4-零仓位观察,富信科技从事半导体热电制冷器件和组件，细分技术有门槛，但市场规模和客户集中度限制较强。,相比英维克、同飞等更系统级温控公司，富信规模和商业确定性不足，L4。,新应用导入慢。,热电制冷业务稳定。,光通信/数据中心热管理放量。
batch-055,300567,精测电子,2025年年度报告,2026年一季度报告,东吴证券股份有限公司,2025年报&2026一季报点评：25年实现扭亏为盈，看好半导体&显示业务持续放量,reviewed_authoritative_deep_review,D-产业链爆发/关键瓶颈型,tactical_candidate,L3-战术候选,精测电子在显示检测、半导体检测和新能源检测设备上有客户验证、算法和设备稳定性壁垒。,相比北方华创/中微等设备核心龙头低一档，但半导体检测放量值得L3。,半导体检测订单慢，费用拖累。,显示与半导体检测同步修复。,半导体检测成为主增长曲线。
batch-055,000561,烽火电子,2025年年度报告,2026年一季度报告,,,reviewed_with_public_research_gap,D-产业链爆发/关键瓶颈型,tactical_candidate,L3-战术候选,烽火电子在军用通信和应急通信领域具备军工资质、型号配套和可靠性验证。,相比海格通信规模更小，但军工通信门槛明确，L3。,军工订单延期，回款慢。,军工通信订单稳定。,新型号放量。
batch-055,300770,新媒股份,2025年年度报告,2026年一季度报告,万联证券股份有限公司,点评报告：2025年营收稳健增长，内容版权业务表现突出,reviewed_authoritative_deep_review,E-落难白马/反转型,zero_position_watch,L4-零仓位观察,新媒股份有广东IPTV牌照和运营基础，现金流较稳，但用户增长和内容版权业务天花板有限。,相比芒果超媒等更强内容平台，新媒股份增长和护城河偏弱，L4。,IPTV用户/ARPU下滑。,存量业务稳健。,版权和新媒体业务改善。
batch-055,001213,中铁特货,2025年年度报告,2026年一季度报告,,,reviewed_with_public_research_gap,G-股东回报型低估/稳健资产,zero_position_watch,L4-零仓位观察,中铁特货具备铁路特种货运网络和国铁体系资源，稳定性较好但增长和定价权有限。,相比真正高分红公用事业和港口龙头，中铁特货成长弹性不足，L4。,汽车铁路运输需求下滑。,特货运量稳定。,冷链和大件运输增长。
batch-055,601601,中国太保,中国太保2025年年度报告,中国太保2026年第一季度报告,华源证券股份有限公司,保险服务业绩双位数增长，投资收益率稳健,reviewed_authoritative_deep_review,G-股东回报型低估/稳健资产,zero_position_watch,L4-零仓位观察,中国太保拥有保险牌照、品牌、代理人和投资资产，长期价值有基础，但寿险渠道转型、利率和权益市场影响大。,相比招商银行/宁波银行等更清晰金融复利资产，太保仍偏L4观察。,利率下行和投资波动压制内含价值。,保险服务业绩稳定增长。,寿险转型成功、股东回报提升。
batch-055,920971,天马新材,2025年年度报告,2026年一季度报告,开源证券股份有限公司,北交所信息更新：募投产能释放驱动业绩弹性，高端氧化铝新品构筑增长矩阵,reviewed_authoritative_deep_review,D-产业链爆发/关键瓶颈型,tactical_candidate,L3-战术候选,天马新材聚焦高端氧化铝粉体，纯度、粒径控制、客户认证和产能稳定性构成材料门槛。,相比壹石通等材料企业规模小，但新品矩阵和高端粉体值得L3跟踪。,新品放量慢，价格竞争。,募投产能释放带来增长。,高端氧化铝新品进入核心客户。
batch-055,603556,海兴电力,杭州海兴电力科技股份有限公司2025年年度报告,杭州海兴电力科技股份有限公司2026年第一季度报告,东吴证券股份有限公司,2026年一季报点评：业务结构调整拉动收入增速亮眼，剔除汇兑损失业绩符合市场预期,reviewed_authoritative_deep_review,C-GARP成长型,tactical_candidate,L3-战术候选,海兴电力在智能电表和海外AMI系统有全球电力客户、认证和软件平台积累。,相比普通仪表企业，海兴海外客户和系统化能力更强，L3。,海外订单延期或汇率损失。,海外AMI业务稳健增长。,全球智能电网改造加速。
batch-055,688048,长光华芯,2025年年度报告,2026年第一季度报告,太平洋证券股份有限公司,Q1业绩增长靓丽，横纵拓展加速平台化布局,reviewed_authoritative_deep_review,D-产业链爆发/关键瓶颈型,tactical_candidate,L3-战术候选,长光华芯是高功率半导体激光芯片和器件企业，外延、芯片、封装和可靠性构成高技术壁垒。,相比普通光学元件，长光华芯更靠近上游核心芯片，L3。,工业激光需求弱，价格竞争。,激光芯片平台横向扩展。,车载/光通信等新应用放量。
